<?xml version="1.0" encoding="UTF-8" standalone="yes"?>

<tns:queryDescriptor xmlns:tns="http://ki.ru/model/query" xmlns:xsi="http://www.w3.org/2001/XMLSchema-instance"
          xsi:schemaLocation="http://ki.ru/model/query queryDescriptor.xsd">

    <entityClass>Employee</entityClass>
    <returnType>ru.ki.dto.EmployeeVO</returnType>
    <searchParameters>
        <filters>
            <field>fullName</field>
            <operator>START</operator>
            <values>
                <vString>Persona1</vString>
            </values>
        </filters>
        <filters>
            <field>prSex</field>
            <values>
                <vString>MAN</vString>
            </values>
        </filters>
        <filters>
            <field>teritory</field>
            <values>
                <vString>Kolomna</vString>
            </values>
        </filters>
    </searchParameters>

</tns:queryDescriptor>
